{"$schema":"http://json-schema.org/draft-07/schema#","type":"object","additionalProperties":false,"required":["status","files_changed","criteria","questions","kind"],"properties":{"status":{"type":"string","enum":["done","blocked"]},"files_changed":{"type":"array","items":{"type":"string"}},"criteria":{"type":"array","items":{"type":"object","additionalProperties":false,"required":["id","met","evidence"],"properties":{"id":{"type":"string"},"met":{"type":"boolean"},"evidence":{"type":"string"}}}},"questions":{"type":"array","items":{"type":"string"}},"kind":{"type":["string","null"],"enum":["ENVIRONMENT",null]}}}