{
  "status": "done",
  "files_changed": [
    "server/kristy_perimeter_kb.json",
    "server/test/acceptance/twoLinePin.js",
    "server/test/acceptance/k7.test.js",
    "server/test/acceptance/k14.test.js"
  ],
  "criteria": [
    {
      "id": "C1",
      "met": true,
      "evidence": "All nine rBST cards retain the complete ladder. Assumptions: equivalent descriptions of the printed no-treatment claim preserve the required meaning; seven were paraphrased to resolve repetition lint."
    },
    {
      "id": "C2",
      "met": true,
      "evidence": "All nine carrageenan cards explain its origin, organic-food presence, and ingredient-list selection. Acceptance C2 passes."
    },
    {
      "id": "C3",
      "met": true,
      "evidence": "Acceptance C3 passes; no grass-fed guarantee added."
    },
    {
      "id": "C4",
      "met": true,
      "evidence": "Archived source URLs preserved. All 29 changed card fields match their pins; original tips and sources retained."
    },
    {
      "id": "C5",
      "met": true,
      "evidence": "All five acceptance tests pass. Full npm test: 2714 passed, zero failures or skips. twoLineCheck: 181 checked, zero violations. Do-lines regeneration and git diff --check pass. All three previously failing section checks now pass without modification."
    }
  ],
  "questions": [],
  "kind": null
}