{"status":"done","files_changed":["server/lib/sectionRules.json","server/test/sectionRulesContent.test.js"],"criteria":[{"id":"C1","met":true,"evidence":"Six rows match approved order and text. Assumptions: updated the owned test's outdated section order; ALLOWED contains section names, so flags were not added there."},{"id":"C2","met":true,"evidence":"tip_aligned enabled for all six; cards_aligned enabled only for meat and eggs_dairy."},{"id":"C3","met":true,"evidence":"Required sources match; other four source lists preserved. Every source exists."},{"id":"C4","met":true,"evidence":"lintSections returns []. Acceptance: 5/5; npm test: 2638 passed, 0 failed. Probe: 0 wrong. Migration dry-run: every authored sentence placed, nothing written."},{"id":"C5","met":true,"evidence":"Copy checks pass. Loader payload verified: exactly section/rule/checks with matching text. Step 3 required no edit. NOTES: commitGuard omitted because it invokes prohibited git commands; live HTTP check left to admin under the no-network boundary. READY; no STOP triggered."}],"questions":[],"kind":null}