{
  "status": "blocked",
  "files_changed": [
    "server/kristy_perimeter_kb.json",
    "docs/do-lines-review.md"
  ],
  "criteria": [
    {"id":"C1","met":true,"evidence":"All 14 cards meet D1. Exact specified edits applied; pick_jerky KEPT."},
    {"id":"C2","met":true,"evidence":"Zero grass-term matches; pork pointer preserved."},
    {"id":"C3","met":true,"evidence":"chicken_breast survives, remains outside RETIRED, and preserves its cart pick and type veto."},
    {"id":"C4","met":false,"evidence":"Pass rule passes 14/14 against the initial snapshot. Assumptions: supplied aa12a3d prerequisite describes the working copy. Historical baseline verification remains unchecked because git is prohibited."},
    {"id":"C5","met":true,"evidence":"46 changed copy fields pass all forbidden-copy checks."},
    {"id":"C6","met":true,"evidence":"Whole meat section: zero L1/L2/L4/L5 hits."},
    {"id":"C7","met":true,"evidence":"Changed cure sentences pass the acceptance predicate; safety text preserved."},
    {"id":"C8","met":true,"evidence":"Card, readability and step lints pass; six review headlines updated. NOTE: doLines.json regenerated byte-identically."},
    {"id":"C9","met":false,"evidence":"NOT READY: focused tests 159/159; independent checks 10/10; probe zero wrong; dry-run projects 181 cards with zero writes/deletes. Official acceptance, full npm test and commitGuard remain unchecked because they invoke prohibited git commands."}
  ],
  "questions": [],
  "kind": "ENVIRONMENT"
}